{
  "schema_version": "mainframe-env.topic-manifest-registry@1",
  "target_version": "0.9.0",
  "semantic_authority": false,
  "coverage_credit": 0,
  "manifests": [
    {
      "scope_id": "cics-application-api-sources-a",
      "subsystem": "cics",
      "baseline_id": "ibm-cics-ts-6x-application-api-sources-a-2026-09-10",
      "manifest": "conformance/0.9/manifests/cics-application-api-sources-a-topics.json",
      "manifest_sha256": "sha256:ab7120009fb0f2a9d121ffdf518d05960ee006e74f1d28026858cafd6c5467de",
      "topic_count": 173,
      "topic_manifest_sha256": "sha256:344e912ef28b1d9ba4a1a00b4613865d759c3e337ac809ccb23fd4f4358652d5",
      "semantic_authority": false,
      "coverage_credit": 0
    },
    {
      "scope_id": "cics-application-api-sources-b",
      "subsystem": "cics",
      "baseline_id": "ibm-cics-ts-6x-application-api-sources-b-2026-09-10",
      "manifest": "conformance/0.9/manifests/cics-application-api-sources-b-topics.json",
      "manifest_sha256": "sha256:1ee42daba576e3ea55f966ff9c094a8386d7a2777e580a36fb1acdbc4a7712c9",
      "topic_count": 181,
      "topic_manifest_sha256": "sha256:b89c4c5ed41020653deff87bfcc0c27462fe940a6c2defa3650c857d9dda920f",
      "semantic_authority": false,
      "coverage_credit": 0
    },
    {
      "scope_id": "cics-application-api-sources-c",
      "subsystem": "cics",
      "baseline_id": "ibm-cics-ts-6x-application-api-sources-c-2026-09-10",
      "manifest": "conformance/0.9/manifests/cics-application-api-sources-c-topics.json",
      "manifest_sha256": "sha256:54957233e41377648dfff0f9a334866eb63e0cfbef1d25d329d52ec2c984228f",
      "topic_count": 224,
      "topic_manifest_sha256": "sha256:01fb00ebd639d937017cb3f6565cdf38df3c25bb0ebe4393030e66db260d8bc2",
      "semantic_authority": false,
      "coverage_credit": 0
    },
    {
      "scope_id": "cics-bms-map-origin",
      "subsystem": "cics",
      "baseline_id": "ibm-cics-ts-6x-bms-map-origin-2026-09-14",
      "manifest": "conformance/0.9/manifests/cics-bms-map-origin-topics.json",
      "manifest_sha256": "sha256:d74e469a45f1b6baef4add13cdf7941eca2f0615921aa9ab416e76ce675237af",
      "topic_count": 2,
      "topic_manifest_sha256": "sha256:a848e11cb75baf44edbff10234516207756ec2d17beab3619cddf8ec413003cc",
      "semantic_authority": false,
      "coverage_credit": 0
    },
    {
      "scope_id": "cics-file-uow-pilot",
      "subsystem": "cics",
      "baseline_id": "ibm-cics-ts-6x-file-uow-pilot-2026-09-08",
      "manifest": "conformance/0.9/manifests/cics-file-uow-topics.json",
      "manifest_sha256": "sha256:ebee114ef6f94fed008f82c0c2c8c5952144fba20a0421b2b17198d8101a44c5",
      "topic_count": 9,
      "topic_manifest_sha256": "sha256:fb318cc37ebb5a985317bd68a67d0d9614bc4f27edca8a7c4df0464602847007",
      "semantic_authority": false,
      "coverage_credit": 0
    },
    {
      "scope_id": "cics-handle-aid",
      "subsystem": "cics",
      "baseline_id": "ibm-cics-ts-6x-handle-aid-2026-09-14",
      "manifest": "conformance/0.9/manifests/cics-handle-aid-topics.json",
      "manifest_sha256": "sha256:bcddaebb777c63db563be7ab3d22be67ba041da030d4001ad15053fef348e06b",
      "topic_count": 2,
      "topic_manifest_sha256": "sha256:8628fa60497ba97504966f9429927bf23acad1b101182ca2064c4db6c0a96d28",
      "semantic_authority": false,
      "coverage_credit": 0
    },
    {
      "scope_id": "cics-misc-tail-bridge",
      "subsystem": "cics",
      "baseline_id": "ibm-cics-ts-6x-misc-tail-bridge-2026-09-23",
      "manifest": "conformance/0.9/manifests/cics-misc-tail-bridge-topics.json",
      "manifest_sha256": "sha256:4de3505464cb19871d719553e6519364336405147018fe9498531233ba01d966",
      "topic_count": 4,
      "topic_manifest_sha256": "sha256:d88613a155bfb43541df5e0973775af1d2dce2b7488d555d0858a93be2431611",
      "semantic_authority": false,
      "coverage_credit": 0
    },
    {
      "scope_id": "cics-misc-tail-cvda",
      "subsystem": "cics",
      "baseline_id": "ibm-cics-ts-6x-misc-tail-cvda-2026-09-23",
      "manifest": "conformance/0.9/manifests/cics-misc-tail-cvda-topics.json",
      "manifest_sha256": "sha256:526aab2c94e051182a9627123647dd32f03eaad05a5013a3d049a5098a51c152",
      "topic_count": 1,
      "topic_manifest_sha256": "sha256:5cb3be0964a59a86cecc72b625ade3ffb508d781665bd67c914684c33d17e11c",
      "semantic_authority": false,
      "coverage_credit": 0
    },
    {
      "scope_id": "cics-task-association",
      "subsystem": "cics",
      "baseline_id": "ibm-cics-ts-6x-task-association-2026-09-13",
      "manifest": "conformance/0.9/manifests/cics-task-association-topics.json",
      "manifest_sha256": "sha256:b8ec4634564ae3e42f983f53ea344f6784e5fd5fcc7ff1aaeb4f7759914d71d4",
      "topic_count": 1,
      "topic_manifest_sha256": "sha256:68634fcac8020b463fb4ba9749e0276be63aa1c887fe954a81120a5296936135",
      "semantic_authority": false,
      "coverage_credit": 0
    },
    {
      "scope_id": "cics-task-enqueue",
      "subsystem": "cics",
      "baseline_id": "ibm-cics-ts-6x-task-enqueue-2026-09-13",
      "manifest": "conformance/0.9/manifests/cics-task-enqueue-topics.json",
      "manifest_sha256": "sha256:46cd6cc70698d636d1b0f7d21918d1d49f3f71002a66f037e9a2c35db5cab18f",
      "topic_count": 5,
      "topic_manifest_sha256": "sha256:227d3f8ca1df29d60f1ee3fc33ee3ff89e6c172fd0e40311989bc573adbd0287",
      "semantic_authority": false,
      "coverage_credit": 0
    },
    {
      "scope_id": "cics-task-scheduling",
      "subsystem": "cics",
      "baseline_id": "ibm-cics-ts-6x-task-scheduling-2026-09-13",
      "manifest": "conformance/0.9/manifests/cics-task-scheduling-topics.json",
      "manifest_sha256": "sha256:fcf57f8723e7b392dab5571d97acc70bf66928c249f25d2588c510358a034c69",
      "topic_count": 2,
      "topic_manifest_sha256": "sha256:87069b7d6373511c7c06279ab9aceef76fc3f33b3d7028c78ffb82e54b7ad418",
      "semantic_authority": false,
      "coverage_credit": 0
    },
    {
      "scope_id": "cobol-numeric-move-pilot",
      "subsystem": "cobol",
      "baseline_id": "ibm-enterprise-cobol-6.5-numeric-move-pilot-2026-09-08",
      "manifest": "conformance/0.9/manifests/cobol-numeric-move-topics.json",
      "manifest_sha256": "sha256:df9aaa99b077dc5e43b0ccdb0c5c7c15d228d723c74a8d45d1acc40f2cbef512",
      "topic_count": 6,
      "topic_manifest_sha256": "sha256:96b3f6d0d7eb08e90dc8ef465be1cc4549a4e431491d1b32c895cd659dbff067",
      "semantic_authority": false,
      "coverage_credit": 0
    }
  ]
}
